candidate_id,decision_priority,decision_bucket,explicit_ready_signal,recommended_role,recommended_next_phase,rationale,downgrade_reasons,evidence_sources
A2,1,primary_entry_ready,pair_target_ready,default_entry_candidate,design_a2_pair_target_algorithm,"A2 is the default entry because it is pair-target-ready, low-conditioning, stable_non_empty, and still dominated by a direct-control throttle-to-actuator path.",,/mnt/nvme/autopilot_lab/artifacts/studies/20260414_064153_formal_v2_anchor_deep_dive/tables/ardupilot_a2_c1_d1_d2_boundary.csv; /mnt/nvme/autopilot_lab/artifacts/studies/20260416_003634_371133_ardupilot_a2_pair_target_readiness/summary/a2_pair_target_readiness.json; artifacts/studies/20260413_070802_ardupilot_real_generalization_ablation/fits/commands_only__actuator_response__pooled/ridge_affine/matrix_f.csv; artifacts/studies/20260413_070802_ardupilot_real_generalization_ablation/fits/commands_only__actuator_response__pooled/ridge_affine/sparsity_mask.csv; artifacts/studies/20260413_070802_ardupilot_real_generalization_ablation/fits/commands_only__actuator_response__pooled/ridge_affine/metrics.json
A1,2,mechanism_rich_hard_mode,targeted_reproduction_ready,hard_mode_backup_line,keep_as_targeted_reproduction_backup,"A1 is generalized-supported and targeted-reproduction-ready, but it stays in hard mode because the stable signal is a state-continuation path rather than a low-dimensional direct-control entry.",state_continuation_not_direct_control; requires_state_feedback_channel_assumption,/mnt/nvme/autopilot_lab/artifacts/studies/20260414_064153_formal_v2_anchor_deep_dive/tables/px4_a1_b1_matrix_comparison.csv; /mnt/nvme/autopilot_lab/artifacts/studies/20260416_010626_381143_px4_a1_roll_pitch_targeted_reproduction/summary/a1_roll_pitch_targeted_reproduction.json
B1,3,contrast_non_entry,none,contrast_only_candidate,use_for_mainline_exclusion_and_scenario_contrast,"B1 remains a contrast-only candidate because its state-continuation template is local rather than scenario-stable, so it explains A1 but does not justify a mainline entry.",supported_but_local_only; primary_driver=stratification,/mnt/nvme/autopilot_lab/artifacts/studies/20260414_064153_formal_v2_anchor_deep_dive/tables/px4_a1_b1_matrix_comparison.csv; /mnt/nvme/autopilot_lab/artifacts/studies/20260414_064902_formal_v2_in_depth_analysis/tables/stability_boundary.csv
C1,4,boundary_or_pathology,none,boundary_explainer,retain_as_boundary_evidence_only,"C1 stays out of the mainline because it is a stable partial + extreme conditioning sample: the raw autoregressive template persists, but formal support never matures into an entry path.",stable_partial_mask_only; extreme_conditioning; primary_driver=feature_collinearity,/mnt/nvme/autopilot_lab/artifacts/studies/20260414_064153_formal_v2_anchor_deep_dive/tables/ardupilot_a2_c1_d1_d2_boundary.csv; /mnt/nvme/autopilot_lab/artifacts/studies/20260414_064902_formal_v2_in_depth_analysis/tables/ardupilot_conditioning_failure.csv; /mnt/nvme/autopilot_lab/artifacts/studies/20260414_064902_formal_v2_in_depth_analysis/tables/stability_boundary.csv; /mnt/nvme/autopilot_lab/artifacts/studies/20260413_070802_ardupilot_real_generalization_ablation/fits/commands_plus_state_history__selected_state_subset__pooled/ols_affine/metrics.json; /mnt/nvme/autopilot_lab/artifacts/studies/20260413_091420_ardupilot_generalization_diagnostic_matrix/fits/commands_plus_state_history__selected_state_subset__pooled/ols_affine/metrics.json
D2,5,boundary_or_pathology,none,boundary_explainer,retain_as_boundary_evidence_only,"D2 is not a mainline entry because it is a stable raw template + empty mask sample under extreme conditioning, which keeps the structure as boundary evidence rather than a usable entry.",empty_mask; stable_raw_template_but_formally_blocked; primary_driver=feature_collinearity,/mnt/nvme/autopilot_lab/artifacts/studies/20260414_064153_formal_v2_anchor_deep_dive/tables/ardupilot_a2_c1_d1_d2_boundary.csv; /mnt/nvme/autopilot_lab/artifacts/studies/20260414_064902_formal_v2_in_depth_analysis/tables/ardupilot_conditioning_failure.csv; /mnt/nvme/autopilot_lab/artifacts/studies/20260414_064902_formal_v2_in_depth_analysis/tables/stability_boundary.csv; /mnt/nvme/autopilot_lab/artifacts/studies/20260413_124654_ardupilot_state_evolution_guided_nogps_baseline/fits/commands_plus_state_history__selected_state_subset__pooled/ols_affine/metrics.json; /mnt/nvme/autopilot_lab/artifacts/studies/20260413_132622_ardupilot_state_evolution_guided_nogps_diagnostic/fits/commands_plus_state_history__selected_state_subset__pooled/ols_affine/metrics.json
D1,6,boundary_or_pathology,none,failure_boundary_exemplar,retain_as_diagnostic_collapse_boundary_only,D1 is not a mainline entry because it is a diagnostic raw collapse boundary: the mask stays empty and the baseline support template does not survive the diagnostic phase.,empty_mask; diagnostic_raw_collapse; primary_driver=none,/mnt/nvme/autopilot_lab/artifacts/studies/20260414_064153_formal_v2_anchor_deep_dive/tables/ardupilot_a2_c1_d1_d2_boundary.csv; /mnt/nvme/autopilot_lab/artifacts/studies/20260414_064902_formal_v2_in_depth_analysis/tables/ardupilot_conditioning_failure.csv; /mnt/nvme/autopilot_lab/artifacts/studies/20260414_064902_formal_v2_in_depth_analysis/tables/stability_boundary.csv; /mnt/nvme/autopilot_lab/artifacts/studies/20260413_115811_ardupilot_state_evolution_stabilize_baseline/fits/commands_plus_state_history__selected_state_subset__pooled/ols_affine/metrics.json; /mnt/nvme/autopilot_lab/artifacts/studies/20260413_122521_ardupilot_state_evolution_stabilize_diagnostic/fits/commands_plus_state_history__selected_state_subset__pooled/ols_affine/metrics.json
